{
  "capabilities": {
    "exclusive_claim": {
      "status": "unavailable"
    },
    "persistent_files": {
      "status": "unverified"
    }
  },
  "created_at": "2026-10-20T11:52:25Z",
  "created_by": {
    "agent": "fixture-agent",
    "instance": "prompt-15-fixture",
    "platform": "local-test",
    "role": "example-producer"
  },
  "graph_digest": "7a627e90213897925d75fbe4fba875ad007dd38e753ddcfee55bb4bd18517a47",
  "graph_revision": "g0001",
  "instance_id": "demo-research-roofing-r0001",
  "mode": "standalone_single_writer",
  "run_id": "run-001",
  "schema_version": "1.0.0",
  "trigger_kind": "manual"
}
