{
  "capabilities": {
    "exclusive_claim": {
      "status": "unavailable"
    },
    "persistent_files": {
      "status": "unverified"
    }
  },
  "created_at": "2026-10-20T11:52:25Z",
  "created_by": {
    "agent": "fixture-agent",
    "instance": "prompt-15-fixture",
    "platform": "local-test",
    "role": "example-producer"
  },
  "graph_digest": "333d3904f487455cfa87c383bb0c166166ac5bd45653c9ef5ad58f3d39d38c4a",
  "graph_revision": "g0001",
  "instance_id": "demo-parallel-crm",
  "mode": "standalone_single_writer",
  "run_id": "run-001",
  "schema_version": "1.0.0",
  "trigger_kind": "manual"
}
