{
  "capabilities": {
    "exclusive_claim": {
      "status": "unavailable"
    },
    "persistent_files": {
      "status": "unverified"
    }
  },
  "created_at": "2026-10-20T11:52:25Z",
  "created_by": {
    "agent": "fixture-agent",
    "instance": "prompt-15-fixture",
    "platform": "local-test",
    "role": "example-producer"
  },
  "graph_digest": "9530e1202263314dbcd0c76228b8d39da5d33c281d3b711cc7b923eac8847d0c",
  "graph_revision": "g0001",
  "instance_id": "demo-parallel-landing",
  "mode": "standalone_single_writer",
  "run_id": "run-001",
  "schema_version": "1.0.0",
  "trigger_kind": "manual"
}
