{
  "capabilities": {
    "exclusive_claim": {
      "status": "unavailable"
    },
    "persistent_files": {
      "status": "unverified"
    }
  },
  "created_at": "2026-10-20T11:52:25Z",
  "created_by": {
    "agent": "fixture-agent",
    "instance": "prompt-15-fixture",
    "platform": "local-test",
    "role": "example-producer"
  },
  "graph_digest": "fb1b28402b939d87a71d907aced1b142d821a85e99a987c0d50fbbc6be1dfc80",
  "graph_revision": "g0001",
  "instance_id": "demo-lifecycle",
  "mode": "standalone_single_writer",
  "run_id": "run-001",
  "schema_version": "1.0.0",
  "trigger_kind": "manual"
}
